headline;analytics
Can Data-Driven Accounts Receivable Management Strengthen Client Relationships?;1
How AI Is Helping New Startups Succeed;1
“Above the Trend Line” – Your Industry Rumor Central for 1/11/2021;1
12 segredos sombrios da Inteligência Artificial;1
AI-IOT: a powerful combination of the future;1
Interview: Kathy Baxter, Architect of Ethical AI Practice at Salesforce;1
Samsung anuncia Exynos 2100, chip do Galaxy S21;1
How Big Data is Changing the Internet Experience for Average Consumers;1
Top Priorities for Finance Leaders in 2021;1
Qual é o cenário para inteligência artificial em 2021?;1
Como a tecnologia de chatbots trouxe resultados a um serviço público essencial;1
How AI Will Shape the Future of Customer Communications;1
Driving data lake success with automated governance, storage options and enterprise readiness;1
Qualcomm combina capacidades de IA e 5G em novo Snapdragon 888;1
Estas são as 10 startups de IA mais atraentes para o mercado em 2020;1
How big data impacts the finance and banking industries;1
4 Strategies to Rev Up B2B Sales Growth in 2021;1
Digital commerce predictions for 2021;1
Customers Want Experiences, Not Chatbots;1
Molecula Secures $17.6 Million in Series A Funding to Democratize Machine-Scale Analytics and AI;1
6 Reasons That Data-Driven Email Verification Is Absolutely Critical;1
Artificial Intelligence Creates Tremendous Changes for the Direction of Marketing;1
Will Predictive Analytics Help Forecast Profitable IPOs for Stock Traders?;1
Why New Email Clients Rely Heavily on the Latest Big Data Advances;1
Data-Driven Learning & Development Are Keys to Employee Retention;1
Chegou a Hora das Empresas Usarem ITOA (IT Operations Analytics)?;1
Linguagens R e Python Entre as Top 10;1
Docker Tools Accelerate Advances in AI Technology in 2021;1
Brands Invest in Data-Driven Tools to Boost Editing Workflows;1
Prepare-se para a revolução do trabalho em qualquer lugar;1
Deep learning: a porta de entrada para a educação do futuro;1
O que a ciência de dados nos reserva para 2021?;1
How AI will Completely Transform Education;1
Big Data is Pivotal to the Future of Education;1
What does integration of artificial intelligence and advanced analytics mean in business?;1
TI deve crescer 10% em 2019 no Brasil. Saiba onde estarão os investimentos;1
AI-Driven Employee Monitoring Software Solves the Most Pressing Organizational Challenges;1
Nvidia Fall GTC 2020 Roundup: A6000 GPU, Omniverse, More;1
Landbot closes $8M Series A for its ‘no code’ chatbot builder;1
Customer Data Analytics is Critical to the Future of Account-Based Marketing;1
Panel Discussion: Needed Data Skills for 2021;1
XAI: Are We Looking Before We Leap?;1
Genesis of a Model Intelligence Platform – Truera;1
Big Data Plays Key Role in Helping Satellites Get Launched into Orbit;1
Top 5 Big Data Trends Influencing Education in 2021;1
How Enterprises Can Extract Meaningful Insights from Unstructured Data;1
Data Science Salon for Healthcare, Finance & Technology;1
Isso é muito Black Mirror! Patente da Microsoft tem bot que imita pessoas mortas;1
40% dos executivos não conseguiram lidar com suas cadeias de suprimentos no auge da crise;1
Cloud e provedores de telecomunicações mostram as promessas e vantagens do 5G;1
Na América Latina, somente 8% das empresas obtêm retorno com IA;1
How ML Powers Data Access Governance with Immuta & Databricks;1
Levity is a ‘no-code’ AI tool to let anyone create workflow automations;1
5 Pacotes Python Que Todo Cientista de Dados Deve Conhecer;1
Aqui estão algumas buzzwords mal utilizadas na TI para serem evitadas;1
"
Sisense Leaps From Cool Vendor To Visionary, And 5 Key Takeaways From the 2017 Magic Quadrant ";1
KPMG: Brasil possui 702 startups de Inteligência Artificial;1
Por que Python promete ser a linguagem que governará as empresas;1
Understanding Google Analytics: Making the Most Out of GA for Best Results;1
Federal Reserve Considering Formal Request for Public Feedback about the Adoption of AI in the Financial Services Sector;1
El BIG DATA, una palanca imprescindible para mejorar los ingresos de los negocios B2B y B2C;1
SaaS Data Ownership: The Key to Data Protection and More Impactful Machine Intelligence;1
English learning app ELSA lands $15 million Series B for international growth and its B2B platform;1
“Above the Trend Line” – Your Industry Rumor Central for 2/1/2021;1
AI Creates New Trading Opportunities for Investors Buying Real Estate Stocks;1
Conheça a moeda digital para troca de café por mercadorias;1
Microsoft adiciona IA e ferramentas de vídeo ao Office mobile;1
Data Analytics Shows How COVID 19 Impacted Search and User Behavior Online;1
What Are the Industries That Benefit Most from Big Data?;1
Cigarro eletrônico com IA pode ajudar a parar de fumar;1
Data Engineering Survey: 2021 Impact Report;1
Big Data Analytics Has Potential to Massively Disrupt the Stock Market;1
7 principais tendências de ERP para 2021;1
Academia and Industry Meet to Reimagine the AI Graduate;1
Harnessing the Dark Side of Data to Drive Business Impact;1
Syngenta Crop Protection e Insilico Medicine utilizarão a IA para transformar a inovação e a sustentabilidade;1
Otimismo marca dez previsões do IDC para 2021;1
Vieses em máquinas. E nós com isso?;1
7 Data-Driven Hacks to Create a Spectacular Video Marketing Campaign For 2021;1
10 tendências de segurança da informação para 2021;1
AI Solving Real-world Problems and AI Ethics Among Top Trends for 2021, According to Oxylabs’ AI and ML Advisory Board;1
"Nova IA pode projetar vacinas contra o coronavírus ""em segundos""";1
Investimentos em IA no Brasil podem chegar a R$ 2,4 bilhões em 2021;1
TOP 10 insideBIGDATA Articles for January 2021;1
Data Analytics Helps Beginning Forex Traders But Doesn’t Replace Common Sense;1
Produção de sêmen para genética cresce 36%;1
New Advances in Graphic Design Software Are Predicated on Machine Learning Algorithms;1
“Above the Trend Line” – Your Industry Rumor Central for 2/9/2021;1
Para 76% dos colaboradores, organização deve fazer mais pela sua saúde mental;1
Tudo converge para os MSSPs;1
O Que e Como Aprender Para Trabalhar com Data Science em 2021?;1
Gurobi Publishes Inaugural State of Mathematical Optimization Report;1
Banco Original usa IA para oferecer serviços para clientes via WhatsApp;1
Todas as partículas do novo coronavírus cabem em uma lata de refrigerante;1
Digital CX: a chave para sobreviver à pandemia;1
O Que Faz um Engenheiro de Dados?;1
Gathering Data Can Be Vital for Your Personalized Financial Plan;1
Maioria dos armazéns no Brasil se encontra em estágio inicial da Transformação Digital;1
Python: curso gratuito oferece 10 mil vagas;1
Bridging the Data Migration Gap;1
How Third-party Data Can Enable Better Business Insights;1
7 Dicas Para Cientistas de Dados;1
Make Your Lazy Data Not So Lazy;1
Big Data Insights Show Surprising Impact of Diversity on Likelihood of Successful Ransomware Attacks;1
insideBIGDATA Latest News – 2/17/2021;1
EHR/EMR Software Development Recommendations in a Health Market Governed By Big Data;1
Bot-as-a-service: present is great, future even better;1
5 Livros Para Aprender Estatística Para Data Science;1
AI Will Take Construction Robotics from Hype to Reality;1
Qlik Announces Inaugural Professor Ambassador Class to Celebrate Educators Helping to Create a Data-Literate World;1
My Robot Brings All the Boys to the Yard, Its AI is Better than Yours;1
Video Highlights: COVID Data Community Profile Report;1
Five Proven Lead Generation Strategies to Merge with Data Analytics;1
Federated Learning – Machine Learning em Edge Computing;1
Digitate Announces Results of Inaugural Autonomous Enterprise Survey, Reveals Redundant Tasks as Number One IT Operations Challenge;1
This A.I. is like Google Image Search For Imaginary Pictures;1
Aprendizagem organizacional: sua chave para o sucesso da IA;1
“Above the Trend Line” – Your Industry Rumor Central for 2/23/2021;1
Business Intelligence: Gamification as a Strategic Tool for Organizations;1
6 Big Data Mistakes You Must Avoid At All Costs;1
How AI & Price Optimization Can Offset COVID-19’s Impact on B2B Supply Chains;1
What Is Enterprise Data Science?;1
Nemo, Dataportal e Databook, Soluções do Facebook, Airbnb e Uber Para Descoberta de Dados;1
Gradio vs Streamlit vs Dash vs Flask – Deploy de Modelos de Machine Learning em Python;1
IA em nuvem: conheça 5 curiosidades sobre a tecnologia;1
AI in Cybersecurity: Six Considerations for 2021;1
AI is Real Estate’s Secret Weapon for Efficiency, Accuracy and Customer Satisfaction;1
13 carreiras mais promissoras de acordo com especialistas;1
Prophecy.io Launches Low Code Data Engineering SaaS Platform for Spark with $6M investment;1
"Zorroa Launches Boon AI; No-code Machine Learning for Media-driven Organizations";1
Video Highlights: Why Do ML Models Fail?;1
Interview: Targeting is Becoming a Data Science Problem;1
10 tendências em Dados e Analytics para CIOs ficarem de olho;1
5 impactos da computação em nuvem na manufatura;1
O futuro do agronegócio no Brasil passa pela agricultura preditiva e autônoma;1
Why Scientists are Teaching Robots to Play Hide-and-Seek;1
OTP Group launches collaboration with 15 startups;1
TOP 10 insideBIGDATA Articles for February 2021;1
Data Evolution in the Cloud: The lynchpin of competitive advantage;1
Interview: Luminati CEO, Or Lenchner;1
How NLU is Helping Improve Agent Performance For Better CX;1
What the Internet of Things and Edge Computing Really Mean Today;1
Nvidia e Dasa firmam parceria para desenvolver algoritmo de combate à Covid-19;1
ENTREVISTA: Inteligência Artificial é futuro do Day Trade, diz especialista da XP Por Investing.com;1
NVIDIA A100, A40 and NVIDIA RTX A6000 Ampere Architecture-Based Professional GPUs Transform Data Science and Big Data Analytics;1
A China tem um plano para virar líder mundial em IA;1
Inteligência de decisão: o novo Business Intelligence;1
Mitigando os riscos ocultos da transformação digital;1
insideBIGDATA Latest News – 3/9/2021;1
Interview: Unlocking Audience Understanding with NLP AI;1
10 principais conclusões do Microsoft Ignite para CIOs;1
“Above the Trend Line” – Your Industry Rumor Central for 3/11/2021;1
"
      IBM Talk'n'labs: as tendências da tecnologia em evento técnico gratuito
    ";1
Mistakes to Avoid When Starting a Career in Data Science;1
Why Do We Keep Using Games as a Benchmark for A.I.?;1
Video Highlights: AI’s Role in Fight Against COVID-19;1
How Financial Institutions Can Deal with Unstructured Data Overload;1
8 Conceitos Estatísticos Fundamentais Para Data Science;1
Vagas mais concorridas: inteligência artificial para selecionar candidatos cresce na pandemia;1
10 tecnologias que serão disruptivas nos negócios em 2021;1
Why the Future of Healthcare is Federated AI;1
Inteligência Artificial: Como a tecnologia está transformando o agronegócio, por Alexandre de Alencar;1
Como as crises proporcionam novos formatos de analisar dados;1
Best of arXiv.org for AI, Machine Learning, and Deep Learning – February 2021;1
Algoritmo identifica bovinos individualmente no campo por meio de imagens;1
ServiceNow aposta em desenvolvedores cidadãos em último impulso empresarial;1
ServiceNow apresenta nova versão da Now Platform;1
Magento fecha parceria com Microsoft Azure no Brasil;1
IFS lança IFS Cloud, plataforma única em nuvem baseada em API;1
Topmind anuncia expansão com nova área especializada em analytics;1
Como Gro Intelligence Pode Ajudar Agricultores Brasileiros;1
Dona do Snapchat entra para o e-commerce de moda;1
Startups dos EUA apostam em IA para inovar setor de cadeira de rodas;1
Governança de IA: como reduzir riscos e colher recompensas;1
6 tendências de infraestrutura e operações que estão em alta e 5 que estão em baixa;1
Comércio exterior: investir em ferramentas tecnológicas é saída para atender demanda na pandemia;1
Como os gerentes de projetos podem usar analytics para melhorar resultados de negócios;1
Inteligência artificial da IBM pode debater sobre 100 temas com humanos;1
Nvidia constrói supercomputador em 20 semanas com a ajuda de um pequeno robô;1
Microsoft vai premiar histórias inspiradoras de mulheres em cibersegurança;1
Informação: a melhor aliada das PMEs em crescimento;1
Duas a cada três organizações mudarão estratégias de supply chain nos próximos anos, diz estudo;1
Mochila com IA ajuda na locomoção de cegos em vias públicas;1
Como garantir que os desenvolvedores cidadãos criem IA de maneira responsável;1
Inteligência Artificial torna a borda e a IoT mais inteligentes;1
10 tendências tecnológicas para o setor público, segundo o Gartner;1
IA para vídeos: Facebook investe em reconhecimento inteligente de imagens e sons postados pelos usuários;1
"""Seu cachorro é bonito!"": youtuber usa IA de um jeito criativo no Canadá";1
Abin abre edital e oferece bolsas nas áreas de segurança digital;1
Algoritmos do nosso dia a dia;1
Como Alan Turing contribuiu (e muito) para a inteligência analítica;1
Comitê de Inovação da ABAG estimula a  promoção de ferramentas inovadoras para beneficiar as cadeias do agronegócio;1
10 principais tendências de tecnologia para o setor público em 2021;1
COAMO investe em inovador sistema de segurança eletrônica para prevenção de riscos;1
44,8% dos executivos brasileiros consideram a IoT como indispensável;1
Como a IA e a IoT podem melhorar a experiência do consumidor?;1
Quem é o dono dos dados? Governança é a chave para a eficiência;1
Analytics: desafios do uso de dados no mapeamento dos clientes;1
Como Analytics e Inteligência Artificial melhoram a experiência do cliente;1
O Pix pode ajudar as empresas a serem data-driven;1
"IA de empresa criada por Elon Musk já é capaz de ""escrever"" 4,5 bilhões por dia";1
"
Video: Why Fast Business Intelligence Matters ";1
Uso responsável de inteligência artificial ainda é baixo nas organizações;1
BIA, a inteligência artificial do Bradesco, passa a se posicionar contra o assédio;1
7 maneiras pelas quais a nuvem está mudando;1
Authentic Artists is building virtual, AI-powered musicians;1
Tecnologia para revolucionar a avicultura;1
Aporia raises $5M for its AI observability platform;1
Hiperautomação: a chave tecnológica para melhoria contínua de processos das companhias;1
Yext co-founder unveils Dynascore, which dynamically synchronizes music and video;1
Comet announces $13M Series A for ML model building tool;1
Como a Inteligência Artificial está revolucionando o treinamento de talentos;1
Plataforma exclusiva da IBM ajuda programadores em suas carreiras;1
Wonder Dynamics raises $2.5M seed to equip indie filmmakers with AI-powered VFX;1
CIOs buscam aumentar equipes de automação, de nuvem e de analytics em 2021;1
Nvidia e HPE trabalham em novo supercomputador focado em IA na Suíça;1
Facebook libera novo conjunto de dados open source para buscar IA menos tendenciosa;1
Nvidia lança framework com automação por IA para setor de segurança cibernética;1
Nvidia anuncia CPU de data center para cargas de computação massivas;1
Extra Crunch roundup: UiPath’s IPO filing, predicting revenue, how to pivot properly, much more;1
AI-driven audio cloning startup gives voice to Einstein chatbot;1
Future of Transportation: Autonomous Cars, Self-Driving Planes, and More;1
Por que todo profissional precisa estudar ciência de dados;1
Startups diversas abrem mais de 300 vagas de emprego;1
Embrapa Informática Agropecuária seleciona bolsista de nível superior;1
Nintendo Switch Pro to Use DLSS to Unlock 4K Gaming;1
Why data and analytics are critical on the farm;1
Hive raises $85M for AI-based APIs to help moderate content, identify objects and more;1
Metade dos clientes deseja que instituições financeiras atue como consultores em decisões de despesas;1
Maioria dos CMOs ainda enfrenta desafios para adotar IA para estratégias personalizadas;1
Building a creator-focused OS;1
Big data will become central to healthcare following the pandemic;1
Extra Crunch roundup: Klaviyo EC-1, micromobility’s second wave, UiPath CFO interview, more;1
50 empresas de IA para ficar de olho em 2021;1
O open source chega a Marte;1
Líderes de TI reavaliam conjuntos de habilidades para o futuro;1
Kry closes $312M Series D after use of its telehealth tools grows 100% yoy;1
The future of e-commerce: Trends, tips, traps to avoid;1
Finance AI Is Critical to CFO Digitalization Efforts;1
The insideBIGDATA IMPACT 50 List for Q2 2021;1
insideBIGDATA Latest News – 4/27/2021;1
“Above the Trend Line” – Your Industry Rumor Central for 4/16/2021;1
How Yum! Brands Uses Location Data from Foursquare to Make Smarter Decisions;1
JADBio Provides AutoML for BioMed Data;1
Book Review: Machine Learning for Kids;1
COVID and Compliance Shape 2021’s Data Workflow and Forensics Trends;1
How Harnessing Data Can Lead to Better Financial Outcomes;1
insideBIGDATA Latest News – 4/8/2021;1
insideBIGDATA Latest News – 3/22/2021;1
3 Reasons a Cloud Data Warehouse Is Critical To Customer Analysis;1
“Above the Trend Line” – Your Industry Rumor Central for 3/30/2021;1
TOP 10 insideBIGDATA Articles for March 2021;1
Domino Data Lab Debuts New Solutions with NVIDIA to Enhance the Productivity of Data Scientists;1
The Fate of Feature Engineering: No Longer Necessary, or Much Easier?;1
Tipos de dados;1
Cenário hipotético da contratação de um cientista de dados;1
0. Introdução;1
Conversica Alternatives: AI Assistants for Marketing Teams;1
Understanding NoSQL Databases: Document Stores;1
Protecting Your Data Lake Requires a New Mindset;1
Importance of Teaching Data Science in CS Programs;1
Data-Driven Cryptocurrency Traders Spur the Growth of Other Industries;1
Financial Chief Data Officers Making Advances in Data Management and Compliance but Over Half of Manual Processes Remain;1
Big Data Becomes Pivotal to the Construction Industry;1
Strategies to Leverage Your Customer Data for Optimal Customer Retention;1
Study: Most Executives Consider Big Data Crucial but Lack Strategies;1
Understanding the Tremendous Benefits of IoT for Small Businesses;1
How Startups Can Formulate Data-Driven Marketing Strategies Using AI;1
The 6-Step Guide to Integrating Business Intelligence and Analytics;1
How is Mobile Intelligence Reshaping the Marketing Industry?;1
Big Data Trends That Are Disrupting Management Maintenance;1
The Growing Importance of AI for Small Businesses;1
Reasons Data Science Consultants Can Be Excellent Investments;1
5 Benefits of Using AI for Wireframing a Design;1
Preparing for The Most Common Data Science Job Interview Questions;1
Boasting a pedigree in business intelligence, Sweep launches a new carbon accounting and offset tool;1
Legal and Compliance Function Needs Data Scientists;1
5 Legal Technology Trends Changing In-House Legal Departments;1
Big Data Is Rapidly Changing How We Look at Economics;1
Hiperautomação: a chave tecnológica para melhoria de processos das companhias;1
4 dicas para lançar uma estratégia de dados de sucesso;1
“Above the Trend Line” – Your Industry Rumor Central for 4/30/2021;1
AI is Not a Magic Bullet for Renewables;1
Remote Workers Demand Data-Driven Cybersecurity Platforms;1
How AI Is Going to Drastically Change the Future of the Automotive Sector;1
Goldman Sachs is betting on artificial intelligence to dive growth;1
TOP 10 insideBIGDATA Articles for April 2021;1
Gastos com computação em nuvem aumentam 35% enquanto AWS permanece na liderança;1
How AI and IoT Play an important role in healthcare today;1
Challenges of Predictive Analytics for Law Enforcement;1
Central Bank of Bahrain launches the Bahrain Supernova Fintech Challenges on FinHub 973 to drive open innovation across the Financial Services industry;1
Personalized nutrition startup Zoe closes out Series B at $53M total raise;1
Big Data Creates Numerous New Perks in the Gig Economy;1
Crucial Benefits of Collecting and Analyzing Data for Modern Businesses;1
Sprout.ai raises $11M Series A led by Octopus Ventures to apply AI to insurance claims;1
11 segredos sombrios da multicloud;1
Lightmatter’s photonic AI ambitions light up an $80M B round;1
No-code in Big Tech: Why Key Players Embraced it in 2020, and How they Can Leverage it in 2021;1
5 investors discuss the future of RPA after UIPath’s IPO;1
How to Overcome Obstacles in Data Lake and Warehouse Strategies: 3 Best Practices for Enterprise Architects;1
How 2020 Made Event Streaming and Management Vital for Future Business Growth and Adaptability;1
IA a serviço da nutrição animal;1
Como a inteligência artificial ajuda na experiência do usuário?;1
Photography Trends Utilizing Data To Keep Your Social Content Fresh;1
Video Highlights: Business Analyst or Data Scientist? What Field to Choose If you Want to Launch a Startup in Future;1
Fronteiras entre Chief Data Officer e Chief Digital Officer estão se tornando cada vez mais confusas, diz estudo;1
Novas tecnologias para análise de solo são debatidas no LATAM Life Science Expo;1
insideBIGDATA Latest News – 5/11/2021;1
Os segredos obscuros do Data Analytics e por que uma investigação honesta é necessária;1
DataRobot expands platform and announces Zepl acquisition;1
Chineses usam nanopartículas de carbono para criar tinta invisível supersegura;1
Apptopia raises $20M to expand its competitive intelligence business beyond mobile;1
5 razões para considerar o profissional de TI um verdadeiro ‘herói’ das empresas;1
Data Fabric Architecture is Key to Modernizing Data Management and Integration;1
Empresa irmã do Google quer usar IA para tornar o futebol mais previsível;1
Pandemia fez 43% dos negócios globais acelerarem uso de IA;1
Ciência por trás da nutrição é responsável pela segurança e confiabilidade dos alimentos oferecidos aos animais;1
Data Roadblocks for AI – Most common challenges and how to avoid them;1
Demanda por gasolina e etanol despenca no Brasil enquanto a procura por diesel dispara, aponta S&P Global Platts;1
Emotion-Sensing A.I. is Here, For Better or Worse;1
Facebook desenvolve IA capaz de desprezar dados pouco úteis;1
7 Key Industries Being Transformed by Data Savvy Virtual Agents;1
Video Highlights: Generalized Additive Models – Allowing for some wiggle room in your models;1
Best of arXiv.org for AI, Machine Learning, and Deep Learning – April 2021;1
Democratizing Machine Learning to Empower the Modern Business;1
How Big Data Has Become Integral to Commercial Fleet Success;1
Estoque de etanol no Brasil deve fechar maio com queda de 29% ante ano anterior, estima S&P;1
Big Data Leads to Massive Changes in Website Management and Development;1
Why an AI-Driven SEO Campaign Is Vital for Your Business;1
8 investors and founders highlight Valencia’s potential as a fintech and cybersecurity hub;1
Semantix anuncia parceria com Microsoft Azure;1
Google Cloud lança nova plataforma de machine learning gerenciada;1
This tech was science fiction 20 years ago. Now it’s reality;1
5 formas como hackers escondem seus rastros;1
Tecnologia, habilidade e governança são lacunas para uso de IA nas empresas;1
Do You Need a Chief Data Officer?;1
Father and son duo take on global logistics with Optimal Dynamics’ sequential decision AI platform;1
Factors Influencing the Cost of Developing an AI-Based Smart Home App;1
Própolis brasileira terá reconhecimento internacional;1
Chile-based Kredito raises $4M to help businesses get loans;1
The Role of Business Intelligence in The Modern Commercial Organization;1
Why Local SEO Marketers Need an Extensive Understanding of Analytics;1
The Role of Cookies in Analytics and Privacy Issues they Raise;1
Data Analytics Contributes to the Abrupt Rise of Clean Energy Investment;1
Dooly raises $80M more for its AI tools to help salespeople manage their busywork;1
One Giant Leap Forward for Data Governance;1
S&P Global Platts aponta que demanda por diesel no Brasil deve crescer 4,4% em 2021;1
O sucesso do ‘desenvolvedor cidadão’ requer forte supervisão de TI;1
Extra Crunch roundup: Jam City SPAC, startup PR, telemedicine market map, more;1
5 Sure-Fire Tips How AI Is Going to Improve Fintech in 2021;1
Using Data Science and Artificial Intelligence in Your Tech Company;1
What to Consider When Choosing a Masters in Business Analytics;1
Walmart Innovates at the Retail Edge with AI;1
Korea’s Riiid raises $175M from SoftBank to expand its AI-based learning platform to global markets;1
Flush with $42M, hot AI startup Faculty plans to hoover up more PhDs… and steer clear of politics;1
Vagas para desenvolvedores com salário de até R$ 15 mil;1
Taipei-based computer vision startup eYs3D gets $7M Series A;1
Canvas lands $20M so tech’s biggest companies can find diverse talent;1
Make These Three AI Marketing Mistakes at Your Peril;1
Atlan raises $16M led by Insight Partners to build a collaboration hub for data-driven teams;1
Extra Crunch roundup: Lordstown Motors’ woes, how co-CEOs work, Brian Chesky interview;1
Com IA, Google quer unificar dados para Analytics em ‘malha’ inteligente;1
Improving Customer Experience through Interaction Analytics;1
Agro 4.0: aplicação de Big Data cria vantagem estratégica no comércio de alimentos;1
Quantum Machine Learning – An Introduction to QGANs;1
Como o Processamento de Linguagem Natural pode ajudar empresas a entenderem seus negócios;1
Breinify announces $11M seed to bring data science to the marketing team;1
Google Cloud lança solução de compartilhamento de dados para mercado de capitais;1
