headline;analytics
Investing in Big Data and AI for Post-COVID-19 Success;1
Organizations Use Robotic Polishing for AI-Driven Manufacturing;1
Advantages of Using Microsoft Azure for Data Preservation and Security;1
Using Data Analytics to Map eCommerce Customer Journeys;1
6 investors and founders forecast hockey-stick growth for Edinburgh’s startup scene;1
APIs: The Real ML Pipeline Everyone Should Be Talking About;1
Non-negotiables for SaaS solutions;1
Why 3D is the Key to Unlocking Vital Video Surveillance Data;1
AI, Machine learning, and big data: laws and regulations;1
Video Highlights: Challenges of Operationalizing ML;1
UCLA DataFest Winners Announced, Presentations Posted;1
Hats Over Hearts;1
New Study Details Importance of TCO for HPC Storage Buyers;1
Video Highlights: BigQuery + Notebooks: Building an Analytics Pipeline on Kaggle;1
Detecting and Mitigating Fraud at Scale;1
O que são estruturas condicionais e para que servem?;1
Referência;1
O que é processamento de linguagem natural?;1
Analytics em tempo real: 7 dicas para o sucesso;1
AIOps: The Iron Man Suit for IT Leaders;1
Principais Soluções de Machine Learning;1
Combinados desse post:;1
Falamos no episódio;1
Sumário;1
insideBIGDATA Latest News – 6/1/2021;1
Knowledge Graphs 2.0: High Performance Computing Emerges;1
TOP 10 insideBIGDATA Articles for May 2021;1
Analytics irá desenhar o merchandising do futuro;1
Google shares its $2M Black Founders Fund among 30 European startups;1
“Shazam das indústrias”: startup que usa inteligência artificial para manutenção recebe R$ 17 milhões;1
“Above the Trend Line” – Your Industry Rumor Central for 6/4/2021;1
The Four Shifts Needed to Make Quantum Computing Part of Your Analytics Strategy;1
Seguradoras aceleraram transformação digital durante a pandemia de Covid-19, aponta estudo;1
Como a TI pode ajudar na luta contra as mudanças climáticas;1
Leveraging AI-Driven Latent Semantic Indexing in Your Online Strategy;1
Video Highlights: Supercharging our Data Scientists’ Productivity at Netflix;1
When Big Data Meets Big Law – the Role of Data in Legal Services;1
Is Google BigQuery The Future Of Big Data Analytics?;1
The Impact of Digital AI Advances on The New Workplace;1
Mendel raises $18M to tease out data structure from medicine’s disparate document trove;1
É possível automatizar todas as operações em nuvem?;1
Why Predictive Analytics Is Crucial for Maximizing College Retention Efforts;1
Supercede Analytics to streamline outward  reinsurance submissions;1
AI Leads to New Complications and Opportunities in PPC Marketing;1
Croatia’s Gideon Brothers raises $31M for its 3D vision-enabled autonomous warehouse robots;1
AI pioneer Raquel Urtasun launches self-driving technology startup with backing from Khosla, Uber and Aurora;1
Extra Crunch roundup: Security data lakes, China vs. Starlink, ExtraHop’s $900M exit;1
AI startup investment is on pace for a record year;1
Como uma equipe de IA de sucesso realmente se parece;1
AI and Chance: Five Industries Resisting Prediction;1
Atomic-backed Jumpcut uses data to advance diversity in film;1
Productivity startup Time is Ltd. raises $5.6M to be the ‘Google Analytics for company time’;1
Rich Data Corporation secures $15 million to accelerate growth;1
Surpassing Decentralized Data Management Woes with Data Virtualization;1
Como o machine learning pode transformar o varejo;1
Facebook Built an A.I. That Intentionally Forgets Things;1
5 Benefits of Training Data-Driven Teams in Microsoft Office 365;1
Using AI to Automate Marketing Processes Using Salesforce Tools;1
Extra Crunch roundup: EU insurtech, 30 years of ‘Crossing the Chasm,’ embedded finance’s endgame;1
8 tecnologias que irão impactar o supply chain ainda em 2021;1
How AI and Behavioral Science are Addressing Vaccine Hesitancy;1
2021 MLOps Platforms Vendor Analysis Report;1
Enterprise AI platform Dataiku launches managed service for smaller companies;1
Webinar: Using External Data to Accelerate Business in a Post-Vaccinated World;1
Yana’s mental health tool for Spanish speakers nears 5 million users;1
1. Introdução;1
Big Data Partnerships Drive Growth in the Global Remittance Market;1
Selecting the Right AI Business Model for Your Startup;1
Demanda por combustíveis cresce no Brasil devido ao aumento na mobilidade, aponta a S&P Global Platts;1
Elisity raises $26M Series A to scale its AI cybersecurity platform;1
Meet the mobile therapy startup backed by Christian Angermayer’s re:Mind Capital;1
Don’t Import It, Embed It! 5 Reasons to Embed Business Intelligence into Your Enterprise Applications;1
Introhive raises $100M for AI-powered sales tools to help companies build ‘relationship graphs’;1
Gloat raises $57M to reinvent the internal job board;1
Tractable raises $60M at a $1B valuation to make damage appraisals using AI;1
eqtble, a platform that uses data analytics to create healthier workplaces, raises $2.7M seed;1
AI Under the Hood: Object Detection Model Capable of Identifying Floating Plastic Beneath the Surface of the Ocean;1
How to Use Citizen Data Scientists to Maximize Your D&A Strategy;1
KeepTruckin raises $190 million to invest in AI products, double R&D team to 700;1
How the Shift to Remote Work is Accelerating Speech Recognition;1
Investors say Eindhoven poised to become Netherlands’ No. 2 tech hub;1
A Laundry List for Cleaning Messy Data and Making It Business Ready;1
4 histórias de sucesso de transformação digital;1
O que a indústria de serviços financeiros tradicional pode aprender com as fintechs;1
Inteligência Artificial na nova era Covid;1
The 3 Reasons Enterprises Need an AI Operating System for Intelligent process Automation;1
Como escolher o RPA certo: 10 fatores a considerar;1
Merlyn Mind emerges from stealth with $29M and a hardware and software solution to help teachers with tech;1
Memory.ai, the startup behind time-tracking app Timely, raises $14M to build more AI-based productivity apps;1
AI drug discovery platform Insilico Medicine announces $255 million in Series C funding;1
Data, Data Everywhere–Are You Capturing The Data Gold From Your Facilities?;1
Google Cloud lança nova plataforma de visão computacional para controle de qualidade fabril;1
8 razões pelas quais projetos de ciência de dados falham;1
How To Start Using AI to Streamline Content Marketing for Churches;1
Huge Benefits Data Scalability Can Create for Your Business;1
Every Business Needs an Analytics-Driven Content Marketing Strategy;1
Smart data and AI use can ‘nudge’ customers to better offers;1
Business Intelligence vs. Operational Intelligence – What Businesses Should Know;1
AWS e Salesforce ampliam parceria focada na experiência unificada do desenvolvedor;1
Governança de IA: por que executivos devem se preocupar?;1
DALL-E – A Human-like Intelligence through Multimodality;1
The Amazing Applications of Graph Neural Networks;1
15 fintechs com vagas abertas em tecnologia;1
Algoritmo de IA restaura o quadro mais famoso de Rembrandt;1
Video Highlights: Emil Eifrem on the Origins of Neo4j and the Ubiquity of Graphs;1
Como os CIOs estão requalificando seus times para o sucesso digital;1
Data Centers Are Reshaping the Future of eCommerce Management;1
Facebook Analytics será descontinuado neste mês;1
How we built an AI unicorn in 6 years;1
Guidelines for Writing Stellar Research Papers While Utilizing Big Data;1
Choosing the Best WordPress Hosting for a Data-Intensive Website;1
NIC.br e ANPD assinam acordo de cooperação para proteção de dados;1
Inteligência Artificial no Comex 4.0;1
Inteligência artificial diferencia e conta plantas de macaúba e babaçu no campo;1
Proteção de dados no campo;1
Intrinsic é o novo laboratório de inteligência robótica da Alphabet Inc.;1
What Are State-Sponsored Cyber Attacks and Do They Use AI?;1
Using Data Analytics to Determine if a Fintech Site is Safe to Use;1
Data Strategy: The Missing Link in Your Digital Transformation Plan;1
Top 10 Big Data CRM Tools To Increase Business Sales;1
5 Massive Ways that Big Data Affects Recruitment;1
Data-driven iteration helped China’s Genki Forest become a $6B beverage giant in 5 years;1
The Next AI Frontier: Business Impact and ROI;1
MLOps: Bringing AI to the Tactical Edge—and Making It Work;1
Robotic AI firm Covariant raises another $80 million;1
CRM’s Have a Big Data Technical Debt Problem: Here’s How to Fix It;1
Turning Big Data into better data with MLOps;1
Como entender onde o uso da inteligência artificial trará resultados;1
4 Ways Data-Driven Automation Enhances Merchandise Distribution;1
Using Data Analytics to Build Dedicated Project Teams: Steps to Success;1
Use Flow Analytics to Improve Visbility and Drive Agile Improvement;1
IBM e Michael J. Fox Foundation usam IA para prever a progressão da doença de Parkinson;1
Why Modeling Languages are the Key to Data-Based Decision Making;1
NVIDIA Advances Instant AI with North American Availability of Base Command Platform;1
The Massive Importance of UX Design for Data-Driven Online Businesses;1
\nWhat’s the Big Deal With Embedded Analytics? ;1
3 Ways to Monetize Data and Analytics;1
Improving Data Processing with Spark 3.0 & Delta Lake;1
Startup demite empregados com big data e CEO polemiza: 'improdutivos';1
Equipes de banco de dados e infraestrutura em nuvem precisam ampliar o diálogo;1
5 formas de aproveitar melhor o valor dos dados abertos;1
The Secret of Neuro-Symbolic AI, Unsupervised Learning, and Natural Language Technologies;1
Minority Report? Pentágono testa IA que 'prevê o futuro';1
Cresce popularidade de linguagens de programação para IA e data mining, aponta Tiobe;1
The Data Engineering Cloud: Three Lessons for a New Era;1
5 Analytic Tools Companies Use To Organize and Study their Data;1
Businesses Across Various Industry Verticals Use Data Analytics;1
Company Cultures That Data-Driven Business Owners Can Learn Them;1
Pesquisa cria máquina de poda e pré-poda da videira;1
As 5 Linguagens de Programação mais usadas em 2021;1
Neon cria curso gratuito de tecnologia para refugiados e vulneráveis;1
What Is Work Really Like Today? Leaders and Employees See Things Differently;1
Importance of Data-Driven Cybersecurity for Medical Device Companies;1
A Agricultura realmente possui um alto volume de dados?;1
Koppert e Jacto firmam parceria para aplicação de biodefensivos com drones;1
Smarter Business – Harnessing Artificial Intelligence;1
4 tendências cruciais para o futuro da nuvem pública, segundo o Gartner;1
DevOps vs. DataOps: What’s the Difference?;1
Agrishow 2022 já tem data definida;1
7 principais tendências de Business Intelligence para 2021;1
How Automation Streamlines Data Management;1
Odontoprev avança conceito de phygital com adoção de IA;1
A Beginner’s Guide To Data-Driven Technical SEO;1
SAP compra SwoopTalent, focada em aprendizado de máquina para RH;1
5 dicas essenciais para contar boas histórias usando dados;1
Boehringer Ingelheim anuncia parceria com a Lifebit para detectar surtos de doenças usando Inteligência Artificial;1
Quando o RPA encontra a ciência de dados;1
4 Ways to Use Analytics to Measure and Optimize Business Growth;1
Microsoft contrata ex-Uber para reforçar estratégia consumer do Teams;1
Espalhando alguns dos riscos iminentes sobre o uso do multicloud;1
Why You Need a Data Strategy for Your Customer’s Embedded Analytics;1
Why It’s Time to Embrace Data Lakes;1
Leveraging Data Science To Grow And Manage Your Team;1
What is the Cost of Hiring Data Savvy Software Developers?;1
Top 5 Data-Driven Lease Accounting Software Solutions;1
Data-Driven Approaches to Better Optimized Enterprise Workflows;1
Data Modernization: Breaking the AI Vicious Cycle for Superior Decision-making;1
Digital Twins: 4 histórias de sucesso;1
Let’s make a deal: A crash course on corporate development;1
A VC shares 5 things no one told you about pitching VCs;1
Vale a pena investir em IA para autoatendimento?;1
O que é cloud native? A maneira moderna de desenvolver software;1
Companies betting on data must value people as much as AI;1
Como a bioeconomia circular pode combater a crise climática;1
Should Your Team Be Using Microservice Architectures?;1
São Manoel estende uso de inteligência artificial para a indústria;1
Emailing Spectrum Customer Service as a Data-Driven Consumer;1
Can Predictive Analytics Identify Future Crypto Profitability?;1
5 Things You Didn’t Know About FDA Data-Driven Software Validation;1
Tesla revela novo chip de treinamento de IA para supercomputador;1
Telum: IBM apresenta novo chip focado em inteligência artificial;1
"‘Grande renúncia’ atinge também a TI; Como CIOs devem se preparar";1
Mathematical Optimization: A Powerful Prescriptive Analytics Technology That Belongs In Your Data Science Toolbox;1
Confirme seus dados e continue recebendo nossas oportunidades de negócios;1
As verdades que o mercado brasileiro -e você- precisam ouvir sobre Big Data.;1
Using Analytics To Decide Which Cryptocurrency To Invest In;1
Data Con LA 2021 is Coming! Best Regional Data Conference;1
8 dicas para CIOs melhorarem a experiência do cliente com equipes ágeis;1
Level AI lands $13M Series A to build conversational intelligence for customer service;1
Los 8 Beneficios que aporta el Big Data a las transacciones del sector financiero;1
A Data and Analytics Leader’s Guide to Data Literacy;1
Techstars’ Saba Karim is coming to TechCrunch Disrupt 2021;1
Data Centers Are Reshaping the Future of eCommerce Management;1
Raízen busca avaliação de até R$ 100 bilhões para realizar IPO;1
Indicativo de chuva nos EUA deve pesar sobre as cotações dos grãos, diz analista;1
São Domingos aposta em ferramenta de inteligência artificial para bater recorde agrícola;1
Open banking: meus dados, minhas regras;1
Segurança de dados na era do PIX;1
Deep learning: a porta de entrada para a educação do futuro;1
O Pix pode ajudar as empresas a serem data-driven;1
Ipsos: Brasileiros buscam benefícios e segurança de dados com Open Banking;1
How To Interact With Power BI Data In A PowerPoint Presentation;1
As 12 principais ferramentas de BI de 2021;1
Elucidate launches open database of financial crime risk scores in the banking industry;1
Importance of Both AI or VPN Technology in the Future of Privacy;1
Setor de educação apresenta maior interesse em uso de Cloud BI;1
Encarregado de Dados é o novo cargo responsável pela regulamentação da LGPD nas empresas;1
Can Online Machine Learning Tools Help with Personal Financial Management?;1
Understanding the Growing Pushback Against Advertisers Collecting Data;1
How to Build a Digital Business Technology Platform;1
\nBuilding Analytic Apps: Essential Reading for Developers ;1
How To Enhance Your Jira Experience With Power BI;1
Understanding Intention: Using Content, Context, and the Crowd to Build Better Search Applications;1
Making the Leap from Data Science Hopeful to Practitioner;1
Meet Flo – The First Period & Ovulation Tracker that Uses Neural Networks;1
Manage Deploys MemSQL for Real-Time Analytics;1
Scaling a Small Data Team with the Power of Machine Learning;1
Harte Hanks Brings Next Generation Data and Analytics to Marketers with Opera Solutions’ Signal Hub Platform;1
Top Technical Analysis Tools for Traders;1
GE Introduces New Analytics to Advance Electric Grid Operations;1
How Harnessing Data Can Lead to Better Financial Outcomes;1
Data Science Salon for Healthcare, Finance & Technology;1
Microsoft Azure AI for Health Initiatives;1
Alzheimer’s Disease Data Initiative launches new AD Workbench to foster greater global research innovation and accelerate breakthroughs in Alzheimer’s disease and related dementias;1
An Enterprise AI Platform Created to Make Industry 4.0 a Reality;1
Interview: Razorsight Delivers Analytics Solutions for Communications World;1
Unisys Survey Finds Airports’ Investment in Analytics Technology Set to Soar as Digital Transformation Needs Take Flight;1
Legal and Compliance Function Needs Data Scientists;1
Nova ferramenta do Google ajuda os clientes a escolher os data centers com menor pegada de carbono;1
AI: technology to fight financial criminals and money launderers;1
10 Data-Driven Design Tips for Creating Advertisements;1
Why hybrid cloud environments require live data replication technology;1
How workforce planning analytics builds stronger businesses;1
IBM Streams brings real-time insights to IBM Cloud Pak for Data;1
Modernize applications with automated, self-service data;1
Why data science at banks is missing the mark, and how to fix it;1
3 IBM Analytics events you can't miss this fall;1
How advanced analytics pulls insights from the weather, part 2 ;1
How advanced analytics pulls insights from the weather, part 1;1
5 fundamental questions for your data journey;1
Can data governance create user satisfaction?;1
Ingest and analyze streaming event data at scale with IBM Db2 EventStore;1
9 experts answer your top data science & machine learning questions;1
Octo Telematics Transforms the Insurance Industry with Machine Learning and Analytics Platform;1
3 Reasons Why Data Collection Won’t Work Without Human Interference;1
COVID-19 Dashboard Uses Machine Learning to Track Global Pandemic;1
Current-Day Problems with Analytic Rendering: Why an Open Standard is Needed and What an API Design Could Look Like;1
Machine Learning Comes to Tour de France;1
Keys to Managing Real Time Data During COVID-19;1
Machine Learning is Your Secret Weapon for Customer Acquisition;1
\nLeveling Up to Custom Actionable Analytic Apps with Sisense BloX ;1
How Money Laundering Concerns Require New AI Monitoring Solutions;1
4 Amazing Time Saving Analytics Tools For Social Media Marketing;1
Has Machine Learning Made Cryptocurrencies Traceable?;1
O Banco do Futuro Terá Cofres de Dinheiro e Cofres de Dados;1
Rise of AI has seen adoption of automation tools across various sectors;1
Data Analytics Help Safeguard Businesses From Online Scams;1
Data analytics is critical for preventing investing mistakes;1
Invaluable Tips for Selecting Internet Service in the Age of Big Data;1
Comparing and Contrasting Two Innovative Analytics-Driven CMS Platforms;1
Band Protocol Partners with digital asset data company Brave New Coin to bring decentralized price reference data to DeFi;1
Will COVID-19 Show the Adaptability of Machine Learning in Loan Underwriting?;1
Narrow AI Helps Call Centers Cope During COVID-19;1
Calling All Data Professionals: SQream Launches the Massive Data Video Challenge;1
Comparative Testing of GPU Servers with New NVIDIA RTX30 Video Cards in AI/ML Tasks;1
O ambiente PCI Compliant e a segurança no uso dos dados;1
Kirin 9000, processador da Huawei, deixa vídeos borrados em alta definição graças à IA;1
Mount Yale announces launch of Alpha Intelligent StrategiesSM employing machine learning and ensemble methods – Plans to launch ETFs.;1
Data center do Google vai substituir diesel por baterias;1
The Continuous Intelligence Report: The State of Modern applications, DevSecOps and the Impact of COVID-19;1
New Research from TrueCue Reveals Majority of Local Authorities are Providing Incoherent Data Analytics Training for Staff;1
Democratização dos dados passa pela tecnologia da informação;1
Pesquisa em inteligência artificial deve ter tom positivo, indica Google;1
The 6 Types of Data Everybody Should Know to Avoid Confusion;1
How to retain your data privacy amidst the growing data harvesting concerns;1
Como Algoritmos Evolucionários se comparam?;1
IBM Cloud Pak for Data update brings more automation, speed to digital transformations;1
New Open-Source Tools Use Machine Learning to Streamline Content Writing Process;1
5 Data-Driven Amazon Ads Ideas to Skyrocket Sales;1
3 NLP Trends Prime for Improvement in the New Year;1
The Pivoting Role of Internet Safety Rules in the Era of Big Data;1
Amazing Data-Driven Software Applications Revolutionizing Inventory Optimization;1
Dispelling the myths: IBM’s ongoing investment in IBM Planning Analytics, powered by IBM TM1;1
Can Data-Driven Accounts Receivable Management Strengthen Client Relationships?;1
App é obrigado a excluir fotos de usuários por treinar IA sem permissão;1
AI-driven Platform Identifies and Remediates Biases in Data;1
When data met water in Kenya: IBM Service Corps;1
Necessária para o ‘novo normal’, Indústria 4.0 depende de gestão dos dados e da informação;1
Molecula Secures $17.6 Million in Series A Funding to Democratize Machine-Scale Analytics and AI;1
A.I. Generated This Hilarious Eminem Diss Of Mark Zuckerberg;1
No-Code, 5G, AI, dados e segurança: 5 aspectos de TI para ficar de olho;1
Minerva Foods recebe habilitação para exportar carne processada aos EUA;0
Reunião que define diretrizes do Plano Safra está prevista para esta segunda, 21;0
Inovações no manejo de pragas e doenças contribuem com a qualidade da safra;0
Usina de açúcar e etanol Batatais anuncia compra da Cevasa Por Reuters;0
USDA volta a reduzir índice de lavouras de soja e milho em boas/excelentes condições dos EUA nesta 2ª feira;0
Minerva Fine Foods conquista habilitação para exportar produtos cozidos e congelados aos EUA;0
CNH Industrial adquire a Raven Industries;0
Frango: preços estáveis ou com leve queda nesta segunda-feira (21);0
Exportações brasileiras podem ter ano histórico em 2021;0
Milho: B3 cai nesta 2ªfeira e segue com tendência de baixa;0
Quais são as frutas da época? Saiba aqui;0
Café: Após dia volátil, baixo volume de chuva volta a dar suporte e arábica sobe em NY;0
Rússia deve fornecer trigo para Argélia pela 1ª vez em mais de quatro anos Por Reuters;0
Brasil exporta mais de 610 mil t de açúcares e melaços na 3ª semana de junho;0
Cana: Estiagem prolongada deve derrubar moagem no PR entre 6% a 10% em 21/22;0
Embarques de carne suína têm ritmo mais fraco e temor por redução de compras pela China;0
Exportação de soja do Brasil em junho reduz ritmo e fica abaixo de 2020, diz Secex;0
Poder de compra do avicultor cresce;0
Exportações de carne de frango atingem 90% do faturamento de junho/20 em 13 dias úteis;0
Açúcar salta mais de 2% nesta segunda-feira na Bolsa de NY;0
Procafé confirma maior volume de grão chocho e grão moca e alerta para rendimento da safra;0
Estimativas da Epagri indicam safra de inverno positiva em Santa Catarina;0
Volume exportado de carne bovina registra avanço na 3ª semana de Junho/21;0
Programa para descomplicar o agro é lançado;0
Exportação de milho avança pouco na semana e junho/21 ainda não embarcou nem 1% do registrado em junho/20;0
Cursos do SENAR-PR oferecem apoio para as atividades dentro da propriedade;0
Safras & Mercado alerta para possibilidade de redução nas exportações de carne bovina para a China no segundo semestre;0
Governo Federal entrega mais de 50 mil títulos no Pará;0
ANP: Etanol está menos competitivo que gasolina em todos os estados do Brasil e no DF;0
USDA traz embarques semanais de milho e soja dos EUA dentro das expectativas;0
Importação de milho GMO dos EUA não compensa para setor de proteína animal;0
Projeto da Epamig vai transformar a cafeicultura em Minas Gerais;0
Peru eleva em 30% exportação de tangerina nos dois primeiros meses de campanha;0
Especialista da Secretaria da Agricultura prevê inverno dentro da normalidade no RS;0
Em Cristalina/GO milho de sequeiro deve produzir metade do milho irrigado e estimular investimentos;0
Sauditas flexibilizam exigência para carne bovina do Brasil;0
Copersucar agora lidera o comércio de açúcar;0
Exportação de carne bovina segue consistente, mas preocupação com China aumenta;0
Usinas já fixaram preço de 21% do açúcar a ser exportado em 2022/23;0
Soja sobe em Chicago nesta 2ª feira com China comprando e chuvas mal distribuídas nos EUA;0
Frango halal atinge marca de quase 800 mil toneladas embarcadas nos primeiros cinco meses de 2021;0
Governo de Goiás trabalha na execução do Programa Estadual de Bioinsumos;0
Consumo global de café deve superar produção em 2021;0
Soja sobe em Chicago com previsão de seca no Meio-Oeste dos EUA e demanda da China Por Reuters;0
"Açúcar bruto reverte mínimas e avança na ICE; café arábica também fecha em alta Por Reuters";0
Brasil precisa de lei para monitoramento indireto de gado, diz ministra;0
O que falta para a conexão e a digitalização do campo?;0
Agricultores dos EUA apostam no sorgo com aumento da demanda chinesa;0
Produtores cobram medidas do governo para reverter escassez de milho no mercado interno;0
Sojicultor do Paraná vence desafio com produtividade 120% maior que a média;0
"Agenda: BC traz nesta 3ª a ata da última reunião do Copom; Mapa lança Plano Safra";0
44ª edição da Expointer é confirmada;0
Algodão: Produção em 2020/21 ficará entre 2,2 mi e 2,6 mi de toneladas;0
MT inicia colheita de milho com expectativa de produtividade cada vez menor;0
Daoud: Plano Safra vai frustrar expectativa dos produtores;0
EUA consomem menos suco, anulam safra ruim no Brasil e preços derretem;0
"Custo de produção de frango sobe 20% até maio; de suínos avançou 11%";0
"excelente, diz USDA; soja fica em 60% Por Reuters";0
ANFACER realiza Projeto Comprador América do Sul 2021 com o apoio da Apex-Brasil;0
Faturamento bruto estimado dos Cafés do Brasil da espécie arábica corresponde a 78% e de conilon a 22% do total das lavouras cafeeiras;0
Courovale recebe o selo Diamante na Certificação de Sustentabilidade do Couro;0
"Copersucar eleva vendas de açúcar em 20/21 para 5,4 mi t; tem faturamento recorde";0
