headline;analytics
A computação pode ser de borda, mas a segurança deve ser ponto central;1
A IA e as ciências sociais já foram próximas, mas se separaram;1
A Nova Era Dos Negócios: A Importância Dos Dados Na Construção De Marcas;1
A revoluçãoo da Justiça com o Big Data;1
A vez da inteligência artificial na medicina;1
AI for Agriculture;1
Algoritmo de IA descobre rapidamente que a Terra orbita o Sol;1
Amazon entra na corrida da computação quântica oferecendo cálculos pela nuvem;1
Amazon vai ser investigada por uso de dados de vendedores parceiros;1
Bancos criam rede para compartilhar dados e evitar fraudes no Brasil;1
Blockchain: o futuro do armazenamento e gestão de dados;1
Burger King usa chatbot com IA para acelerar processo de recrutamento;1
Cisco traz soluções de ai, machine learning e mais para a feira;1
Huawei apresenta soluções para digitalizar setor bancário;1
Cientistas usam nova arquitetura de IA para evitar rebelião das máquinas;1
Colégio cria curso técnico de inteligência artificial;1
Com AI, setor de serviços corporativos pode criar 26 milhões de empregos até 2030;1
Com cloud e ai, Brasil ganhará primeiro banco de sequenciamento genético;1
Com compra do Tableau, Salesforce quer integrar IA com exposição de dados;1
Como a IA pode ser uma aliada contra às fraudes durante a Black Friday?;1
Como a inteligência artificial já está presente na sua vida;1
Como a Inteligência Artificial pode tornar o trânsito mais seguro?;1
Como empresas têm aplicado Machine Learning para impulsionar negócios;1
Como funciona a Camila, IA humanizada da AWS que converte texto em voz;1
Dados de clientes americanos estavam hospedados em servidor sem senha;1
Dados e inteligência artificial: como um apoia o outro?;1
Especialistas alertam que IA militar pode ser facilmente enganada;1
Este drone usa inteligência artificial para acompanhar os movimentos do seu alvo;1
EUA e Reino Unido agora obrigam empresas de TI a fornecerem dados de suspeitos;1
Facebook testa sistema de reconhecimento facial para verificar identidades;1
Fiat pode fazer parceria com BMW e Daimler para veículos autônomos;1
Fujitsu cria IA para ajudar juízes em Mundial de Ginástica Artística;1
Golpistas estão usando nova técnica para roubar dados de pagamento online;1
Google aposta na inteligência artificial para conquistar os empreendedores;1
Google desenvolve IA capaz de transformar texto em mensagens de áudio;1
Google é acusado de criar ferramenta de espionagem trabalhista;1
Google explica como funciona a IA de recomendações da Play Store;1
Google investe euro 3 bilhões em data centers de energia limpa na Europa;1
Governo brasileiro pode ter criado as bases para uma vigilância igual a da China;1
Governo cria cadastro unificado e regulamenta uso de dados de cidadãos;1
Grupo financiado por Elon Musk libera IA poderosa e assustadora;1
Hackers criptografam o equivalente a 10 anos de dados do governo argentino;1
Huawei Cloud chega ao Brasil com foco em IA e Big Data;1
IA consegue recriar vídeos que você viu com base em suas ondas cerebrais;1
IA contra o câncer;1
IA criada por brasileiros é premiada em desafio internacional;1
IA tenta desvendar os mistérios dos geoglifos impressos no deserto de Nazca;1
Inteligência artificial consegue resolver um Cubo Mágico em pouco mais de 1s;1
Inteligência artificial já é usada em grandes festivais no Brasil;1
Inteligência artificial não é novidade, mas está mais atual do que nunca;1
Inteligência artificial moldará o 6G e as comunicações do futuro;1
Inteligência artificial quer melhorar o ambiente das torcidas de futebol;1
Inteligência artificial: Por que as tecnologias de reconhecimento facial são tão contestadas;1
"LinkedIn come&ccedil;a a usar IA para descri&ccedil;&otilde;es de imagens autom&aacute;ticas no feed";1
Machine Learning cria oportunidades de carreira e negócios - Computerworld;1
"Marca usa intelig&ecirc;ncia artificial e fotografia para criar roupas sob medida";1
Marcos Pontes anuncia criação de 8 laboratórios de IA no Brasil;1
Nova IA da Nvidia promete criar os melhores deepfakes;1
O que os anunciantes realmente precisam saber sobre Deep Learning;1
Santander promove evento gratuito em São Paulo sobre big data para empresas;1
Seu próximo carro poderá estar de olho mais em você do que na estrada;1
Skydio's New Auto-Follow Drone is Basically a Flying A.I. Cinematographer;1
Sony abre divisão focada no desenvolvimento da inteligência artificial;1
Startup cria roupas inteligentes que funcionam como personal trainers;1
Startup de veteranos do Google lança ferramenta grátis de aprendizado de máquina;1
Tainted Data Can Teach Algorithms the Wrong Lessons;1
The Power, and Limits, of Artificial Intelligence;1
Tudo que você precisa saber para trabalhar com Inteligência Artificial - Computerworld;1
USP será o lar do Centro de Pesquisa em IA mais avançado do Brasil;1
Vannevar Labs comes out of stealth to bring best-in-class AI tech to national security agencies;1
Volkswagen inova ao usar a inteligência artificial para facilitar a vida dos motoristas;1
"YouTube lança série sobre IA com Robert Downey Jr.; veja o trailer";1
Data Science for all: What is it? Why care? How do I get it?;1
Recapping the IBM Chief Data Officer Strategy Summit Fall 2017;1
Three “must-have” capabilities to unify data governance;1
Transforming governance in the insights era;1
Transforming a city with data and insight;1
Companies that share data can’t ignore governance;1
Analyze clickstream data with IBM Db2 EventStore for customer insights;1
Big data at NASA;1
An exciting data science experience on Hortonworks Data Platform ;1
The data governance story: How to develop policies & rules;1
Web analytics with IBM Db2 EventStore: Ingest streaming web events data;1
A is for Analytics University;1
Cyber security powered by AI and machine learning;1
Do you know your data? ;1
Why data portability is practiced by Best-in-Class companies;1
Start test driving data governance;1
Big Data and Medical Research;1
How to Build the Right Team for a Successful AI Project;1
Cyxtera Simplifies AI Innovation with AI/ML Compute as a Service Powered by NVIDIA DGX A100 Systems;1
Best of arXiv.org for AI, Machine Learning, and Deep Learning – July 2020;1
Lightmatter Introduces Optical Processor to Speed Compute for Next-Generation Artificial Intelligence;1
Using AI to Optimize Pricing;1
Big Data Analytics Receive a “Spark” In the Arm;1
Get Up to Speed with Data Science in 7 Easy Steps;1
Interview: Pamela McCorduck, AI Industry Pioneer;1
Analyze-then-Store: The Journey to Continuous Intelligence – Part 3;1
Data Warehouse Automation: Five Steps to Success;1
The Problem with Data Lakes: How Enterprises Can Make the Most of Their Data;1
Big Data Performance Report;1
The Value of Data Now vs. Data Later;1
Video Highlights: Delivering the Enterprise Data Cloud;1
Google Cloud Announces BigQuery Omni for Multi-cloud Analytics;1
Analyze-then-Store: The Journey to Continuous Intelligence – Part 2;1
The Impact of Data Science On Customer Intelligence, Space Strategy and Supply Chain Optimization;1
Be More Da Vinci: Why Data Scientists Should Be Working with Designers, Futurists and Business Executives;1
Model Risk Management in the Age of AI;1
Rubber Meets the Road: Reality of AI in Infrastructure Monitoring;1
NVIDIA Ships New Advanced AI System — NVIDIA DGX A100: Third-Generation DGX Packs Record 5 Petaflops of AI Performance;1
oneAPI: – A Unified Cross-Architecture, High Performance Programming Model Designed to Help Shape the Future of Application Development;1
Heterogeneous Computing Programming: oneAPI and Data Parallel C++;1
Esri Provides Free Mapping Software for Organizations Fighting COVID-19;1
Opportunities for Big Data to Improve Energy Usage Across Industries;1
New Salesforce Research AI Simulates Millions of Years of Economic Data Using RL;1
Understanding Forecasting Methods in an AI World;1
AI Usage in Banking is Forcing the Conversation around the Ethical Use of Data;1
The Pros and Cons of Google’s New AI Transparency Tools;1
How AI Is Being Used to Assist U.S. Veterans;1
Accounting for the Unknown in the Time of COVID-19: How Data Scientists Can Adapt;1
Did Big Data Fail Us During COVID-19?;1
Three Ways Data Scientists are Fighting COVID-19;1
Columbia University DSI Alumni Use Machine Learning to Discover Coronavirus Treatments;1
Explainable AI: The key to Responsibly Adopting AI in Medicine;1
Intel Works with University of Pennsylvania in Using Privacy-Preserving AI to Identify Brain Tumors;1
How AI Unlocks Brand Value in Unstructured Data;1
How AI is Transforming the Customer Experience;1
TD Ameritrade Launches AI-Driven Educational Platform;1
7 erros que cometi ao procurar meu primeiro emprego em data science;1
Machine Learning para Avaliação de Risco de Crédito;1
8 ferramentas de Engenharia de Dados que ninguém te conta;1
Engenharia de Dados no Grupo Zap — Data Hackers Podcast 15;1
Coletando bananas com Deep Reinforcement Learning;1
Retenção de Talentos com Data Science;1
Utilizando Machine Learning para classificar grupos de raças de cães.;1
Elasticsearch para ciência de dados acabou de ficar muito mais fácil;1
O que é Natural Language Processing, o tal do NLP — Data Hackers Podcast 27;1
O Que São Feature Stores e Por Que São Essenciais na Escalabilidade em Data Science?;1
Qual a Diferença Entre o Analista de BI e o Cientista de Dados?;1
Governança de Dados em Um Mundo Data-Driven – Parte 7;1
A Diferença Entre Cientistas de Dados, Engenheiros de Dados, Estatísticos e Engenheiros de Software;1
Usufruindo de técnicas Agile para entregar valor com dados;1
Criando uma cultura data-driven na XP Inc. — Data Hackers Podcast 28;1
Introdução ao tidymodels em R;1
\nData Engineering Today: All About the Cloud ;1
\nSisense AI – What it Really Takes to Build a Better Mousetrap ;1
\nThe Next Generation of BI is Here… And So Is The 2018 Gartner Magic Quadrant for Analytics and Business Intelligence Platforms ;1
5 Benefícios da Análise Preditiva com IBM SPSS;1
Série Spark e Databricks Parte 2 – Modos de Execução no Spark;1
Série Spark e Databricks Parte 1 – Arquitetura e Componentes do Apache Spark;1
7 Pacotes Python Para Aumentar a Produtividade do Cientista de Dados;1
5 Livros de Matemática Para Machine Learning;1
Série Spark e Databricks Parte 3 – Interfaces do Apache Spark;1
5 Lições Que Aprendi Em 2 Anos Como Cientista de Dados;1
The State of Data Management – Why Data Warehouse Projects Fail;1
9 Ingenious Ways To Leverage Data-Driven Insights For SEO;1
5 Powerful Networking Technologies That Are Disrupted By AI;1
Search Engine Watch Suggests Data Analytics Key To Local SEO Success;1
Trends In Business Intelligence And Data Science For Retail;1
5 Reasons Data Scientists Must Outsource React JS Development;1
Big Data, Data Science e Machine Learning com Google Cloud Platform e Big Query;1
Um Lucrativo Nicho Para Advogados: Deep Learning;1
A Escassez de Talentos Dificulta a Evolução da Inteligência Artificial;1
Série Spark e Databricks Parte 4 – Spark Context no Databricks;1
Differentiating Between Data Lakes and Data Warehouses;1
Série Spark e Databricks Parte 5 – Spark Session no Databricks;1
Qual a Diferença Entre Cientista de Dados e Engenheiro de Machine Learning?;1
\nData Visualizations in Python and R ;1
How Can We Best Identify and Nurture Promising AI Startups?;1
Video Highlight: A Vision of Analytics — Challenge the Data Warehouse Status Quo;1
Big Data e Cloud Computing – Desafios e Oportunidades;1
Série Spark e Databricks Parte 6 – DataFrameReader Para Leitura de Dados;1
Como o Big Data e o Analytics Estão Transformando o Recrutamento e o RH;1
3 Conceitos Definem o Futuro do Trabalho: Dados, Descentralização e Automação;1
Como categorizar textos usando o LDA;1
Swim Releases New Platform for Managing Continuous Intelligence at Scale;1
Sharp Venture Capitalists Make Remarkable Inroads With Alternative Data;1
7 Ferramentas Essenciais Para Cientistas de Dados;1
Série Spark e Databricks Parte 7 – DataFrameWriter Para Gravação de Dados;1
The Rise of Natural Language Generation in the Financial Services Industry;1
Why We Need ML Ops: 4 Things to Consider When Testing AI;1
Potential of AI and machine learning to stop bot attacks;1
8 artificial intelligence trends transforming 2020;1
IBM revela las 4 aplicaciones de inteligencia artificial para la pospandemia;1
The Impact of Artificial Intelligence in Growth Markets;1
How Automation Helps You Exploit the Value in Big Data;1
How Employee Training In Enterprises Can Benefit From Data;1
Machine Learning em Python e C++;1
Deploy de Modelos de Machine Learning;1
The Secret Sauce for Successful AI? Humans;1
Video Highlights: Data-enabled Hypersurfaces;1
The Université de Sherbrooke partners with  Laplace Insights to push the frontiers  of AI for finance;1
NVIDIA Advances Performance Records on AI Inference;1
5 Crucial Database Practices For Overseeing Sound Big Data Strategies;1
Machine Learning Automation;1
O Kaggle é Realmente Válido Para Aprender Data Science?;1
Série Spark e Databricks Parte 8 – DataFrameWriter e Formato Parquet;1
The Impact of the Covid-19 Pandemic on Conversational AI;1
British could lead the world with first sovereing data exchange;1
The Relationship between Big Data and Protests;1
Freelancers Use Big Data To Streamline Cryptocurrency;1
Deep Dive: How AI and ML improve fraud detection rates;1
NetApp AI and Run:AI Partner to Speed Up Data Science Initiatives;1
12 use cases of AI and machine learning in finance;1
2021 Trends in Data Modeling: Attaining the Universal Data Model Ideal;1
Three-quarters of US AG Businesses Increase 2020 Investment in AI;1
Por Que e Como Data Science é Mais do Que Apenas Machine Learning?;1
The Real AI Revolution: Machines That Learn Like Scientists;1
2021 Trends in Artificial Intelligence and Machine Learning: The ModelOps Movement;1
AWS Certified Machine Learning – Specialty;1
It’s Time to Start Using AI for Supply Chain Risk Management;1
What Does Data Archiving Bring To Healthcare Intelligence?;1
How AI Is Helping Revolutionize Elder Care;1
Top 5 Things You Should Know About the AI-Driven Cyber-Attacks;1
5 Ways that Machine Learning Has Transformed Smart Cards;1
Why advisors are still a long way from embracing AI: Schwab;1
Social Listening with AI Reaches a New Level of Sophistication;1
When Data Science Meets Technical SEO;1
What Does a Data Engineer’s Career Path Look Like?;1
Critical Importance of a VPN in the Age of Data Breaches;1
Precisamos de 2 Engenheiros de Dados para Cada Cientista de Dados?;1
5 Reasons Technical Support is Essential in the Big Data Age;1
4 Spectacular Ways Conversational AI Improves Customer Experiences;1
2021 Trends in Big Data: The Interoperability Challenge;1
Uso de Processamento de Linguagem Natural com Growth Hacking;1
Predictive Analytics is a Proven Salvation for Nonprofits;1
Survey: 97% of Enterprises Seek to Accelerate Data Transformation, with Time Spent on Data Preparation A Barrier to Insights-Driven Decision-Making;1
Data-Driven Ideas for Implementing Blogger Outreach Strategies;1
Teaching Big Data Analytics During Lockdown;1
Deciphering The Seldom Discussed Differences Between Data Mining and Data Science;1
The Impact of Big Data In Business, Past and Future;1
Absolutely Essential AI Cybersecurity Trends to Follow in 2021;1
How big data works? How we use it at FunCorp, and why it’s one of our most important tools;1
4 Ways that Data Analytics Can Boost Performance by Improving Employee Handbooks;1
Why Data Science Isn’t an Exact Science;1
Global SMEs Adopt New Business Intelligence Initiatives During COVID-19 Crisis;1
Five emerging AI and machine learning trends to watch in 2021;1
6 Data Insights to Optimize Scheduling for Your Marketing Strategy;1
What is the Future of Business Intelligence in the Coming Year?;1
Utilizing Data Insights as Stepping Stones to App Development Success;1
How cloud computing can empower e-commerce;1
The future growth of AI and ML;1
2021 Trends in Data Science: The Entire AI Spectrum;1
AI and Ethics: The Path Forward;1
New Survey of Data Science Pros Finds that AI Explainability is their Top Concern;1
Beyond Survival – Data and Analytics Help Businesses Reimagine the Future;1
Barriers Organizations Face when Integrating AI;1
AI-driven IoT: What Businesses Need to Know About the Next Frontier;1
Why Humans Still Need to be Involved in Language-Based AI;1
The Future of Artificial Intelligence in a Post-COVID-19 World;1
NVIDIA DGX Station A100 Offers Researchers AI Data Center-in-a-Box;1
Desafios e cautelas do contencioso de dados;1
How to Catch Payments Fraud with AI;1
Data Automation Has Become an Invaluable Part of Boosting Your Business;1
Real-Time Interactive Data Visualization Tools Reshaping Modern Business;1
7 Tremendous Changes Artificial Intelligence Brings to the Education Sector;1
The Legal Requirements For Gathering Data;1
In The Age Of Big Data, Is Microsoft Excel Still Relevant?;1
Enterprise Search in the Age of AI;1
Data Blueprint – Estratégia de Lançamento de Produtos de Dados;1
Best Ways To Keep Your Data Secure;1
Operação cupido? Japão vai investir em IA para formar novos casais;1
Como Explicar Modelos de Machine Learning Para os Departamentos de Negócios?;1
Ferramentas de Infraestrutura Para Machine Learning em Produção;1
Fundamentos de Cloud Computing Para Cientistas de Dados;1
Dia a Dia do Cientista de Dados no Trabalho Remoto;1
10 Cenários de Como Entregar Um Projeto de Machine Learning;1
How Unrivaled AI & ML Powered Solutions Are Revolutionizing Web Data Gathering Industry;1
VPNs Are Crucial Privacy Protection Tools in the Age of Big Data;1
Rrich Data Corp signs NAB on for AI-enhanced innovation in SME lending;1
Why Data Management is So Crucial for Modern Cities;1
IA resolve problema de décadas que pode revolucionar a medicina;1
Artificial intelligence in agriculture : using modern day AI to solve traditional farming problems;1
The Dream Team: Building The Ideal Product Team with Marvels of Data Analytics;1
5 Incredible Ways Big Data Has Changed Financial Trading Forever;1
3 Incredible Ways Small Businesses Can Grow Revenue With the Help of AI Tools;1
How this startup is using AI for talent acquisition;1
Big Data Proves Invaluable to Retail Supply Chain Management;1
Most Disruptive Data-Driven Software Development Trends in 2021;1
Facebook e mais oito gigantes entram na mira da FTC por coleta de dados;1
Tecnologias de 2021: IA e Machine Learning serão centrais;1
Why Business Analytics is Crucial for Field Service Companies;1
Tribunais adotam plataforma de IA para acelerar processos;1
5 Amazing Ways to Use Data Analytics to Become A Profitable Trader;1
Algoritmo de inteligência artificial ajuda a pilotar aeronave militar dos EUA;1
Big data trends to consider in 2021;1
Microsoft Teams ganha redução de ruídos por meio da IA;1
Data-Driven EHR Systems Are Invaluable to the Patient Experience;1
Observing the Benefits of Data Analytics with Beverage and Food Labeling;1
How articial intelligence and robots are changing the world? use cases of AI and robots;1
Dados e Bolsa de Valores — Data Hackers Podcast 34;1
São Domingos aposta em ferramenta de inteligência artificial para bater recorde agrícola;1
Grupo Pardini investe em integração de dados e inova a experiência do cliente;1
Quando e por que usar big data?;1
7 certificações de análise de dados que compensarão;1
Cloud, analytics e segurança lideram recuperação do mercado de TI em 2021;1
5 desastres de IA e analytics que ficaram para a história;1
Como a edge analytics conduzirá uma computação mais inteligente;1
Como transformar o Analytics em um negócio de impacto;1
Como ficam os dados no pós-pandemia?;1
As 10 tendências em dados e analytics para superar a crise de 2020;1
7 formas de fracassar com o analytics (e como evitá-las);1
4 pontos importantes no uso de analytics na crise da Covid-19;1
Futuro da transformação digital passa pela interligação entre dados;1
5 investimentos em análise de dados que valem o hype;1
87% das empresas têm baixa maturidade em BI e Analytics, segundo Gartner;1
Como a IA contribui para a transformação dos dados?;1
Como a Movida aplicou machine learning para impulsionar seus negócios;1
5 histórias de sucesso de uso de Machine Learning;1
Machine Learning: a melhor prevenção contra ameaças cibernéticas;1
7 razões pelas quais sua estratégia de IA não está funcionando;1
Cai a confiança de clientes sobre o uso ético de dados pessoais, diz estudo;1
3 maneiras para os CIOs melhorarem seu posicionamento com IA;1
Resolver moderação de conteúdo exige humanos para evitar a falta de naturalidade, algo que a IA não consegue fazer;1
Crise da Covid-19 não desacelera demanda por talentos em Inteligência Artificial;1
Interações com clientes habilitadas para IA mais que dobram desde 2018;1
Três em cada quatro organizações investirão em IA ao longo dos próximos seis meses, diz Gartner;1
How Assistive AI Decreases Damage During Natural Disasters;1
Perplexing Impacts of AI on The Future Insurance Claims;1
7 big data goals for 2021: AI, DevOps, hybrid cloud, and more;1
"Youtubers criam IA que transmite ""solo eterno"" de contrabaixo";1
5 maneiras de assumir o controle dos dados em 2021;1
Driving ROI Through AI;1
Study: One in Four Local Companies Engaged with AI Technology;1
The Power of Crunching Big Data Effectively;1
Databricks Partners with RStudio To Increase Productivity of Data Science Teams;1
Databricks Conquers AI Dilemma with Unified Analytics;1
Four Reasons On-premises Object Storage is Right for Today’s Businesses;1
The 6 Types of Data Everybody Should Know to Avoid Confusion;1
How to set your first AI project up for success;1
Big Data & Credit Score: What’s Changing;1
IBM Cloud Pak for Data update brings more automation, speed to digital transformations;1
IBM Chief Data and Technology Officer Summit Series;1
Optimize your data and AI investment with IBM Cloud Pak for Data System;1
Protect against model drift and bias to ensure your AI is accurate, explainable and governed on any cloud;1
Here’s why IDC MarketScape named IBM a leader in advanced machine learning software;1
The Forrester Wave data management leaders excel at automation, integration and governance;1
Deploy a modern data and AI platform on the infrastructure of your choice;1
How industry leaders get their data ready for AI;1
IBM’s open source strategy champions AI trust and transparency;1
Are you building AI that your customers will trust?;1
How AMC uses machine learning to find out more about TV viewers;1
How the Data Science Elite helped uncover a gold mine at Experian;1
Otimizando seu chatbot com a Anallyticabot;1
How Feature Stores will revolutionize Enterprise AI;1
The Catalyst for Widespread AI Adoption;1
The future growth of AI and ML;1
New Open-Source Tools Use Machine Learning to Streamline Content Writing Process;1
Machine Learning is Handy with Content Writing but Expectations Must Be Mediated;1
AI/ML remains the most in-demand tech skill post COVID;1
União Europeia pede por mais clareza no uso da IA;1
Everything in its Right Place: The Potential of Decentralized AI;1
5 Data-Driven Amazon Ads Ideas to Skyrocket Sales;1
Cloud Optimization 2.0: Beyond Better Performance;1
3 NLP Trends Prime for Improvement in the New Year;1
7 Habilidades em Data Science Para Aprender em 2021;1
Text Analytics (NLP) utilizando Python;1
AI Bots revolutionizing the finance and banking space;1
Real estate and Big Data: a match made in heaven?;1
Elevador inteligente fala com o técnico e se autodiagnostica;1
The Pivoting Role of Internet Safety Rules in the Era of Big Data;1
Amazing Data-Driven Software Applications Revolutionizing Inventory Optimization;1
Discovering the Wonders of Data-Driven PPC Marketing;1
Understanding The Phenomenal Impact of Social Data on B2B Funnels;1
Dispelling the myths: IBM’s ongoing investment in IBM Planning Analytics, powered by IBM TM1;1
How money laundering concerns require new AI monitoring solutions;1
Best of arXiv.org for AI, Machine Learning, and Deep Learning – December 2020;1
How the Internet of Things and AI will Transform Sports Business?;1
Integrating AI improves real-time services of Maricopa County Superior Court and Hill Country Memorial;1
Transforming HR through AI: How AI will help plug skill gaps in organisations;1
Making Data Simple: Al Martin and Claude Yusti discuss AI, Data, government and healthcare (part 2 of 2);1
Machine Learning: guia sobre regressões - Parte 1;1
2020’s Biggest Stories in AI;1
Qantas’ earliest days of flight comes to life with Hybrid Cloud and AI;1
MLOps Brings Best Practices to Developing Machine Learning;1
Kyligence CEO Identifies Top Big Data, Cloud, and Data Analytics Predictions for 2021;1
Big data as a tool to improve customer experience;1
Data Governance is Vital to the Future of a World Ruled by Artificial Intelligence;1
GM Financial integrates AI for superior customer service;1
Wunderman Thompson: AI reimagined at scale across the business;1
How trusted AI helps you gain competitive advantage: a Forrester Research leadership conversation with KPMG;1
We All Know about AI in Medicine By Now. Here’s Why It Really Matters.;1
Feature Stores are Critical for Scaling ML Initiatives and Accelerating both Top-line and Bottom-line Impact;1
